{"actions":[{"argv":["make"],"name":"build","phase":"build","timeout_seconds":30}],"artifacts":[{"byte_size":1024,"path":"bundles/segment-1.bundle","sha256":"cccccccccccccccccccccccccccccccccccccccccccccccccccccccccccccccc"}],"dangerous_confirmed":false,"destination":"/home/updater/app","failure_policy":"rollback","filesystem":"ext4","full_fallback_included":true,"generation":1,"lfs_objects":[{"byte_size":1024,"oid":"bbbbbbbbbbbbbbbbbbbbbbbbbbbbbbbbbbbbbbbbbbbbbbbbbbbbbbbbbbbbbbbb","repo_ids":["repo-1"]}],"media_id":"media-1","package_id":"package-1","pairing_token":"0123456789abcdef0123456789abcdef","persistent_paths":["var/data"],"repositories":[{"parent_repo_id":null,"provenance_url":null,"relative_path":".","repo_id":"repo-1","target_commit":"aaaaaaaaaaaaaaaaaaaaaaaaaaaaaaaaaaaaaaaa"}],"routes":[{"final_target_commit":"aaaaaaaaaaaaaaaaaaaaaaaaaaaaaaaaaaaaaaaa","initial_prerequisites":[],"repo_id":"repo-1","segment_ids":["segment-1"]}],"schema":"manifest-v1","segments":[{"base_commit":null,"bundle_kind":"full","byte_size":1024,"generation":1,"oversize":false,"repo_id":"repo-1","segment_id":"segment-1","target_commit":"aaaaaaaaaaaaaaaaaaaaaaaaaaaaaaaaaaaaaaaa"}],"target_commit":"aaaaaaaaaaaaaaaaaaaaaaaaaaaaaaaaaaaaaaaa","target_id":"target-1"}
